[{"id":"a-mssc49o8-4m9q","tipo":"acopio","modalidad":"recolecta","nombre":"Ollita Comunitaria","lat":3.52992,"lng":-76.307429,"coordenadas_nivel":"barrio","ciudad":"Palmira","direccion":"Calle 32a #39-45","descripcion":"Necesitan kits de aseo, medicinas, ropa","destino":{"transporta":false,"ciudades":["Sevilla","Zarzal","Buenaventura","Choco","Cali","Palmira"]},"estado":"sin-confirmar","created_at":"2026-08-14T02:35:23.000Z","ultima_actualizacion":"2026-08-14T02:35:23.000Z","items":[{"tipo":"catalogo","id":"agua"},{"tipo":"catalogo","id":"medicamentos"},{"tipo":"catalogo","id":"insumos-medicos"},{"tipo":"catalogo","id":"elementos-aseo"},{"tipo":"catalogo","id":"cobijas"},{"tipo":"catalogo","id":"colchonetas"},{"tipo":"catalogo","id":"camas"},{"tipo":"catalogo","id":"ropa"},{"tipo":"catalogo","id":"calzado"},{"tipo":"catalogo","id":"panales"},{"tipo":"catalogo","id":"carpas"},{"tipo":"catalogo","id":"herramientas"},{"tipo":"catalogo","id":"linternas"},{"tipo":"catalogo","id":"baterias"},{"tipo":"catalogo","id":"alimentos-bebe"},{"tipo":"catalogo","id":"mascotas"}],"flags":0}]